{
    "customFieldsForFiles": [
        {
            "id": "moods",
            "hidden": false,
            "name": "Moods",
            "type": "items",
            "itemTypeId": "moods",
            "description": "Associate a file or marker with moods or emotions, such as \"Happy\" or \"Sad\"",
            "position": 600,
            "showInListView": true
        },
        {
            "id": "tonalCenter",
            "hidden": false,
            "name": "Tonal center",
            "type": "note",
            "description": "Tonal center (or root note) of a musical piece, for example D♭. Together with the *Tonal quality* field, it makes up the key of a musical piece.",
            "position": 30,
            "showInListView": true
        },
        {
            "id": "tonalQuality",
            "hidden": false,
            "name": "Tonal quality",
            "type": "tonalQuality",
            "description": "Tonal quality of a musical piece, that is, *major* or *minor*. If you need more variety, consider adding a *Scales/modes* field.",
            "position": 31,
            "showInListView": true
        }
    ],
    "customFieldsForMarkers": [
        {
            "id": "019951f6-fa46-7b80-b4c8-54801c12a8b0",
            "hidden": false,
            "name": "Sound source",
            "type": "item",
            "itemTypeId": "019951f6-fa45-7c09-a569-22d90f660df3",
            "position": 1000,
            "showInListView": true
        }
    ],
    "customItemTypes": [
        {
            "id": "moods",
            "hidden": false,
            "name": "Moods"
        },
        {
            "id": "019951f6-fa45-7c09-a569-22d90f660df3",
            "hidden": false,
            "name": "Sound source"
        }
    ],
    "customItems": {
        "moods": [
            {
                "id": "019951f4-bfd2-7fe8-a227-ddd6e19c29e5",
                "hidden": false,
                "name": "Dreamy",
                "customColor": [
                    148,
                    103,
                    189
                ]
            },
            {
                "id": "019951f4-f46f-7693-b179-99734860774c",
                "hidden": false,
                "name": "Rigid",
                "customColor": [
                    23,
                    190,
                    207
                ]
            }
        ],
        "019951f6-fa45-7c09-a569-22d90f660df3": [
            {
                "id": "019951f7-1514-7dfc-9c79-e5c7ec9b761c",
                "hidden": false,
                "name": "Cricket",
                "customColor": [
                    255,
                    127,
                    14
                ]
            },
            {
                "id": "019951f9-1ed2-714f-be12-163b97bf1b22",
                "hidden": false,
                "name": "Stones",
                "customColor": [
                    188,
                    189,
                    34
                ]
            }
        ]
    },
    "files": [
        {
            "path": "assets/7SA8JQ5SRM97H2XC4075TWRRG4-media.m4a",
            "authorId": 0,
            "hidden": false,
            "name": "Siquijor Hill",
            "origin": "imported",
            "importInstallationId": "01991a04-8640-7820-b3bf-3da3754cf705",
            "importId": "019951ae-4098-7ddf-822c-a22ebd3246e0",
            "importBaseFolderHash": "5A6JFGW2HZ3SB3E6KTCCW42RR8",
            "importBaseFolderName": "docs",
            "importPath": "230212-142536-siquijor-hill.wav",
            "importContentHash": "4JRKZ1T9SPS035M0KZ36SRHXEG",
            "importFormat": "wav",
            "customData": {}
        },
        {
            "path": "assets/8E4CN8JX590DTMPA5MFM76HGC4-media.mp3",
            "authorId": 0,
            "hidden": false,
            "name": "Distance",
            "origin": "imported",
            "importInstallationId": "01991a04-8640-7820-b3bf-3da3754cf705",
            "importId": "019951ae-4098-7ddf-822c-a22ebd3246e0",
            "importBaseFolderHash": "5A6JFGW2HZ3SB3E6KTCCW42RR8",
            "importBaseFolderName": "docs",
            "importPath": "Distance.mp3",
            "importContentHash": "8E4CN8JX590DTMPA5MFM76HGC4",
            "importFormat": "mp3",
            "customData": {
                "tonalCenter": "B♭",
                "tonalQuality": "min",
                "moods": {
                    "019951f4-bfd2-7fe8-a227-ddd6e19c29e5": null
                }
            }
        },
        {
            "path": "assets/TT9Q3E82VZN64VY1YP0CF76AR4-media.m4a",
            "authorId": 0,
            "hidden": false,
            "name": "Rügen Sea",
            "origin": "imported",
            "importInstallationId": "01991a04-8640-7820-b3bf-3da3754cf705",
            "importId": "019951eb-b050-7b1f-961e-c669e7657e70",
            "importBaseFolderHash": "5A6JFGW2HZ3SB3E6KTCCW42RR8",
            "importBaseFolderName": "docs",
            "importPath": "ruegen.WAV",
            "importContentHash": "D4GPJ595FT4EVB56M1H99NC76C",
            "importFormat": "wav",
            "customData": {}
        },
        {
            "path": "assets/R00YRM97VVK5M9MSBT9RAVSECG-media.m4a",
            "authorId": 0,
            "hidden": false,
            "name": "Whistling",
            "recordedAt": 1758012017571,
            "origin": "recorded",
            "customData": {}
        }
    ],
    "markers": [
        {
            "id": "019951e5-2158-7455-9435-5e9dfbe83a6f",
            "authorId": 0,
            "hidden": false,
            "fileId": "8E4CN8JX590DTMPA5MFM76HGC4",
            "filePath": "assets/8E4CN8JX590DTMPA5MFM76HGC4-media.mp3",
            "name": "Distorted",
            "start": 153909,
            "length": 15000,
            "rating": 2,
            "createdAt": 1758015594840,
            "comments": [],
            "customData": {}
        },
        {
            "id": "019951e3-c263-7d6e-96ab-0acdc0511c1b",
            "authorId": 0,
            "hidden": false,
            "fileId": "7SA8JQ5SRM97H2XC4075TWRRG4",
            "filePath": "assets/7SA8JQ5SRM97H2XC4075TWRRG4-media.m4a",
            "name": "Loud cricket",
            "start": 254634,
            "length": 15000,
            "rating": 4,
            "createdAt": 1758015504995,
            "comments": [
                {
                    "id": "019951f1-724d-74b6-9245-104e6fb00b68",
                    "hidden": false,
                    "authorId": 0,
                    "createdAt": 1758016401997,
                    "content": "What an awesome cricket sound!"
                }
            ],
            "customData": {
                "019951f6-fa46-7b80-b4c8-54801c12a8b0": "019951f7-1514-7dfc-9c79-e5c7ec9b761c"
            }
        },
        {
            "id": "019951e4-22aa-78e2-a8e8-4a36823d63aa",
            "authorId": 0,
            "hidden": false,
            "fileId": "8E4CN8JX590DTMPA5MFM76HGC4",
            "filePath": "assets/8E4CN8JX590DTMPA5MFM76HGC4-media.mp3",
            "name": "Drop & Flute",
            "start": 98404,
            "length": 15000,
            "createdAt": 1758015529643,
            "comments": [],
            "customData": {}
        },
        {
            "id": "019951f8-317b-7f96-a3ea-652e7e9bf8d0",
            "authorId": 0,
            "hidden": false,
            "fileId": "TT9Q3E82VZN64VY1YP0CF76AR4",
            "filePath": "assets/TT9Q3E82VZN64VY1YP0CF76AR4-media.m4a",
            "name": "Knocking stones",
            "start": 36123,
            "length": 15000,
            "createdAt": 1758016844155,
            "comments": [],
            "customData": {
                "019951f6-fa46-7b80-b4c8-54801c12a8b0": "019951f9-1ed2-714f-be12-163b97bf1b22"
            }
        }
    ],
    "playlists": [
        {
            "id": "019951ef-58e7-707a-8a8c-ac511b84a591",
            "hidden": false,
            "authorId": 0,
            "createdAt": 1758016264423,
            "name": "Nature",
            "items": [
                "/marker/019951e4-22aa-78e2-a8e8-4a36823d63aa#6DHP",
                "/marker/019951e3-c263-7d6e-96ab-0acdc0511c1b#PA5X",
                "/file/7SA8JQ5SRM97H2XC4075TWRRG4#TYCX"
            ]
        }
    ],
    "sheets": [
        {
            "id": "home",
            "hidden": false,
            "title": "Home",
            "content": {
                "type": "doc",
                "content": [
                    {
                        "type": "paragraph",
                        "content": [
                            {
                                "type": "text",
                                "text": "This space is all about nature. Field recordings mixed with music deeply connected to the natural world."
                            }
                        ]
                    },
                    {
                        "type": "heading",
                        "attrs": {
                            "id": "0HPS",
                            "level": 2
                        },
                        "content": [
                            {
                                "type": "text",
                                "text": "Some examples"
                            }
                        ]
                    },
                    {
                        "type": "bulletList",
                        "content": [
                            {
                                "type": "listItem",
                                "content": [
                                    {
                                        "type": "paragraph",
                                        "content": [
                                            {
                                                "type": "jam",
                                                "attrs": {
                                                    "id": "EYPX",